区域,名称,景点id,类型,级别,热度,地址,特色,经纬度
陕西·西安·莲湖区,钟鼓楼广场,3211954174,城市观光,,热度 0.0,陕西省西安市莲湖区钟楼和鼓楼之间,钟楼和鼓楼之间的广场,"108.951418,34.266104"
陕西·西安·莲湖区,太奥奥佳真冰场,3272100257,运动健身,,热度 0.0,西安莲湖区丰禾路太奥下沉广场奥佳真冰场,大人宝宝都可以玩的滑冰,"108.902493,34.287525"
陕西·西安·临潼区,秦始皇陵博物院（兵马俑）,3261940195,文化古迹,5A景区,热度 0.8800000000000001,陕西省西安市临潼县秦始皇陵东1.5公里处,世界第八大奇迹,"109.266029,34.386024"
陕西·西安·临潼区,华清宫,2005661316,文化古迹,5A景区,热度 0.9,陕西省西安市临潼区华清路038号,览盛唐宫阙，登骊山怀古，赏长恨歌舞,"109.218903,34.369881"
陕西·西安·临潼区,黑河森林公园,1676996911,公园,3A景区,热度 0.7,陕西省西安市近郊周至县108国道398公里处,五里一片景，十 里一层天,"108.02196,33.896193"
陕西·西安·临潼区,临潼博物馆,1311542410,展馆,3A景区,热度 0.7,陕西省西安市临潼区环城东路1号,珍藏有西周青铜器、唯一记载武王伐纣的遗物,"109.223096,34.370575"
陕西·西安·临潼区,秦陵地宫展览馆,120708486,展馆,,热度 0.72,陕西省西安市临潼区秦陵北路136号,再现秦汉时期帝王陵寝的历史文化旅游,"109.246571,34.387585"
陕西·西安·临潼区,世界八大奇迹馆,1242793737,展馆,,热度 0.7,陕西省西安市临潼区秦陵路中段168号,每个大奇迹造型逼真，有相当的规模,"109.239344,34.386486"
陕西·西安·秦始皇陵博物院（兵马俑）,秦始皇陵丽山园景区,1397926396,展馆,,热度 0.0,陕西省西安市临潼区秦陵北路西端秦始皇陵丽山园景区正门入口右边,秦始皇帝陵博物院的组成部分,"109.265495,34.385836"
陕西·西安·曲江旅游度假区,大慈恩寺（大雁塔）,1105942423,文化古迹,5A景区,热度 0.72,陕西省西安市雁塔区大雁塔南广场北侧,唐僧（玄奘）藏经处，古都西安的象征,"108.970566,34.222777"
陕西·西安·曲江旅游度假区,大唐芙蓉园,1509067984,公园,5A景区,热度 0.86,陕西省西安市雁塔曲江新区芙蓉西路99号,进入中国盛唐文化之旅,"108.980798,34.218929"
陕西·西安·曲江旅游度假区,曲江艺术博物馆,2998648349,展馆,,热度 0.0,西安市大雁塔南广场西南角（威斯汀酒店负二层）,用壁画讲述中国古代绘画史的博物馆,"108.96749,34.220655"
陕西·西安·曲江旅游度假区,曲江国际会展中心,2193400974,展馆,,热度 0.0,陕西省西安市雁展路1号,综合性展览活动场所,"108.961446648,34.20813949227"
陕西·西安·曲江旅游度假区,曲江寒窑遗址公园,4172763897,展馆,,热度 0.0,陕西省西安市曲江新区寒窑路18号曲江寒窑遗址公园,王宝钏薛平贵爱情见证，情侣推荐,"108.997584,34.204789"
陕西·西安·曲江旅游度假区,大唐不夜城,463585428,城市观光,,热度 0.0,陕西省西安市雁塔区环塔南路东段6号大雁塔南广场,购物、餐饮、娱乐、商务为一体的一站式消费天堂,"108.970536,34.21982"
陕西·西安·曲江旅游度假区,大雁塔北广场,2572045326,城市观光,,热度 0.0,陕西省西安市雁塔区雁引公路,唐诗园林区，法相花坛区，禅修林树区,"108.96886955218,34.227535229245"
陕西·西安·未央区,未央湖游乐园,4078586828,游乐场,,热度 0.7,陕西西安市北郊,西安未央湖游乐园是以集休闲、娱乐为一体的现代大型游乐园，占地近千亩，其中水域面积480亩。未央湖游乐园共分为五大区：南区,"108.98838367001,34.405265815068"
陕西·西安·新城区,大明宫国家遗址公园,2972581121,文化古迹,4A景区,热度 0.72,陕西省西安市新城区自强东路585号大明宫国家遗址公园丹凤门,唐代长安城禁苑,"108.968257,34.309657"
陕西·西安·雁塔区,多元宝贝世界曲江彩虹谷店,2191994374,游乐场,,热度 0.0,陕西省西安市曲江新区雁翔路西北妇女儿童医院南侧,为中国新一代亲子家庭提供健康生活一切需要,"109.017557,34.199986"
陕西·西安·雁塔区,陕西历史博物馆,383907200,展馆,4A景区,热度 0.9199999999999999,陕西省西安市雁塔区小寨东路91号,在这里，见证中华文明,"108.961746,34.230944"
陕西·西安·雁塔区,陕西自然博物馆,2926070680,展馆,3A景区,热度 0.0,陕西省西安市雁塔区长安南路88号,探索自然的奥秘,"108.952239,34.203498"
陕西·西安·雁塔区,西安电视塔西部之光,3164641131,城市观光,,热度 0.0,陕西省西安市雁塔区长安南路88号,俯瞰都市夜景，流光溢彩，美不胜收,"108.951716,34.192912"
陕西·西安·长安区,翠华山,3758813835,自然风光,4A景区,热度 0.7,陕西省西安市长安太乙宫镇翠华山景区,太乙真人修炼地，李世民避暑消夏,"109.013004,33.999399"
陕西·西安·长安区,西安东大秦龙温泉,1237276829,农家度假,,热度 0.0,陕西省西安市长安区东大街办地热开发区东大村88号（三资学院隔壁）,特色皇家园林浴场，放松身心,"108.78751,34.050808"
陕西·西安·长安区,西安秦岭欢乐世界,2686583755,游乐场,,热度 0.0,陕西省西安市长安区秦岭欢乐世界（秦岭野生动物园旁边）,享受疾风的速度，体验失重的快感,"108.863503,34.055151"
陕西·西安·长安区,西安关中民俗艺术博物院,3271368077,展馆,4A景区,热度 0.0,陕西省西安市长安区五台镇南五台山路1号,关中地区历代各族人民智慧结晶的聚集地,"108.978637,34.03458"
陕西·西安·长安区,沣峪庄园滑雪场,193443379,运动健身,,热度 0.7,陕西省西安市长安区喂子坪青岗树村,风景秀丽的高山滑雪场,"108.851109,33.897696"
陕西·咸阳,蓝波湾温泉水世界,3492208249,游乐场,,热度 0.0,陕西省咸阳市东郊朝阳五路中段,温泉养生、休闲度假，商务接待的理想去处,"108.785282,34.376079"
陕西·咸阳,陕商文化博物馆,1414492002,展馆,,热度 0.0,咸阳市西咸新区泾河新城崇文塔景区内,一个以“陕商”为主题的展览馆,"108.949956,34.502454"
陕西·咸阳·泾阳县,郑国渠,3506890410,文化古迹,,热度 0.0,陕西省咸阳市泾阳县西北25公里泾河北岸,始建于战国，形成了全部自流灌溉系统,"108.638964,34.61499"
陕西·咸阳·泾阳县,乐华城•乐华欢乐世界,3614334989,游乐场,,热度 0.0,陕西省西咸新区泾河新城沣泾大道,过山车主题公园,"108.925245,34.478523"
陕西·咸阳·礼泉县,袁家村·关中大观园,3316447666,农家度假,,热度 0.0,陕西省咸阳礼泉县袁家村,陕西的丽江，吃货的天堂,"108.54028481964,34.616724825317"
陕西·咸阳·礼泉县,昭陵博物馆,2104516856,展馆,3A景区,热度 0.72,陕西省咸阳市礼泉县烟霞镇,面积和陪葬墓之多居历代帝王陵墓之首,"108.531932,34.604374"
陕西·咸阳·礼泉县,袁家村必捷滑雪场,1248139779,运动健身,,热度 0.0,陕西省咸阳市礼泉县烟霞镇袁家村“关中印象体验地”向北3公里,冰雪世界里的速度与激情,"108.545342,34.597254"
陕西·咸阳·乾县,乾陵,441556452,文化古迹,4A景区,热度 1.0,陕西省咸阳市乾县城北6公里梁山上,一代女皇圣地，千古盛唐乾陵,"108.226308,34.577233"
陕西·咸阳·秦都区,汉阳陵国家考古遗址公园,2059398113,展馆,4A景区,热度 0.0,陕西省西安市咸阳国际机场专用公路东段,“事死如事生”丧葬观念空前盛行的真实体现,"108.954724,34.448301"
陕西·咸阳·秦都区,咸阳梦幻嬉雪主题乐园,4005199448,运动健身,,热度 0.0,陕西省咸阳市秦都区珠泉路与咸通北路交叉口,冷冬季节，适合玩雪,"108.692074,34.349538"
陕西·咸阳·渭城区,张裕瑞那城堡酒庄,3182727628,农家度假,,热度 0.0,陕西省咸阳市渭城区渭城镇,浪漫意大利，梦幻酒城堡,"108.798244,34.401343"
陕西·咸阳·兴平市,茂陵博物馆,2735337684,展馆,4A景区,热度 0.72,陕西省咸阳市兴平市茂陵博物馆汉武帝陵东500米,感受汉武大帝的雄韬武略,"108.592802,34.34298"
陕西·咸阳·杨凌区,西北农林科技大学博览园,533366560,公园,4A景区,热度 0.0,陕西省咸阳市杨陵区杨凌邰城路3号,整合科教资源的基础上建立起的博物馆群,"108.081016,34.272262"
陕西·咸阳·杨凌区,杨凌现代农业创新园,2593289745,农家度假,,热度 0.0,陕西省咸阳市杨凌区,学游结合，时尚休闲的好去处,"108.049487,34.3047"
陕西·延安·宝塔区,宝塔山,1635837119,自然风光,4A景区,热度 0.9400000000000001,陕西省延安市宝塔区嘉岭路,历史文物与革命旧址合的著名风景名胜区,"109.5032,36.600141"
陕西·延安·宝塔区,清凉山,37283621,文化古迹,3A景区,热度 0.8,陕西省延安宝塔区延安清凉山旅游区,陕北四大石窟之一,"109.498262,36.60855"
陕西·延安·宝塔区,枣园革命旧址,4112163668,文化古迹,4A景区,热度 0.78,陕西省延安市宝塔区枣园镇,我国革命传统教育的重要基地之一,"109.428553,36.633613"
陕西·延安·宝塔区,南泥湾革命旧址,204882123,文化古迹,,热度 0.7,陕西省延安市宝塔区延安城东南45公里处,中国共产党军垦事业的发祥地,"109.677516,36.321241"
陕西·延安·宝塔区,延安1938文化街区,3261456976,城市观光,,热度 0.0,陕西省延安市宝塔区城西北8公里处枣园路,以文化为灵魂，解读红色延安,"109.428553,36.633621"
陕西·延安·黄陵县,黄帝陵,3266042123,文化古迹,5A景区,热度 1.0,陕西省延安市黄陵县城北的桥山颠,中华始祖黄帝轩辕氏的陵墓,"109.280487,35.587062"
陕西·延安·黄陵县,陕西黄陵国家森林公园,206438864,公园,4A景区,热度 0.0,陕西省延安黄陵县店头镇腰坪乡潮塔村,别辜负了子午岭上这一山迷人的景色,"108.971851,35.677051"
陕西·延安·延川县,乾坤湾,3137017478,自然风光,,热度 0.0,陕西省延安市延川县,一幅天然太极图,"110.422567,36.726044"
陕西·延安·宜川县,壶口瀑布（陕西）,2571648404,自然风光,4A景区,热度 1.0,陕西省延安市宜川县壶口乡,有”千里黄河一壶收”的气概,"110.455575,36.151234"
上海·上海,小猪佩奇的玩趣世界,3325673966,游乐场,,热度 0.0,上海市张扬路2389弄2号LCM置汇旭辉广场3F-32,室内家庭主题乐园，亲子时光的优质选择,"121.562349,31.24804"
上海·上海·宝山区,顾村公园,218949671,公园,,热度 0.0,上海市宝山区顾村镇沪太路4788号环岛路1号（近沪太路）,一轴、一带、三区、七园,"121.384711,31.346641"
上海·上海·宝山区,闻道园,3899153026,公园,4A景区,热度 0.0,上海市宝山区潘泾路2888号近石太路,看奇石，赏书画，品茶香，畅游艺术文化园林,"121.410219,31.36199"
上海·上海·宝山区,上海玻璃博物馆,4106077338,展馆,4A景区,热度 0.0,上海市宝山区长江西路上海玻璃博物馆,非凡建筑与先进理念融汇的博物馆,"121.478478,31.349547"
上海·上海·宝山区,美兰湖高尔夫球会,188191026,运动健身,,热度 0.0,上海市宝山区沪太路6655号（内美兰湖路9号）,2011”重新设计打造了原南湖泊球场，这个更名为名人赛球场的新球场为2011美兰湖上海名人赛正式开放。它给予了每一位热情,"121.375501,31.411205"
上海·上海·崇明岛,东平国家森林公园,2051581969,公园,4A景区,热度 0.7,上海市崇明县北沿路2188号,在这里，你只需要深呼吸,"121.487554,31.689225"
上海·上海·崇明岛,东滩湿地公园,2920170810,公园,,热度 0.7,上海市崇明县东滩东旺路,宁静幽美，渔歌悠扬，别有一番滋味,"121.955196,31.521639"
上海·上海·崇明岛,崇明明珠湖公园,1750894621,公园,,热度 0.0,上海市崇明县三华公路333号,人在画中游、情寄绿水间,"121.263895,31.742554"
上海·上海·崇明岛,高家庄园,4043984410,农家度假,3A景区,热度 0.0,上海崇明港西镇港东公路999号（高家庄生态园内）,高雅的景区、温馨的家园、美丽的田庄,"121.433446,31.686413"
上海·上海·崇明岛,前卫生态村,445887781,农家度假,4A景区,热度 0.7,上海市崇明县东平国家森林公园北首,吃农家饭、住农家屋、干农家活、享农家乐,"121.521231,31.722394"
上海·上海·崇明岛,紫海鹭缘浪漫庄园,2201637018,农家度假,3A景区,热度 0.0,上海市崇明县北沿公路2018号,以绿色身心运动为主题的景观创意农场,"121.501848,31.678099"
上海·上海·崇明岛,瀛东生态村,3363759869,农家度假,3A景区,热度 0.0,上海市崇明县陈家镇瀛东生态村,消除疲劳，永远牢记东湖的风情,"121.85010894952,31.470163972072"
上海·上海·崇明岛,光明瑞华果园,329814080,农家度假,3A景区,热度 0.0,上海市崇明县北沿公路3176号,释放快节奏生活的疲惫，感受世外桃源的清幽,"121.33779,31.817938"
上海·上海·崇明县,湖宇生态农场,1320855403,农家度假,,热度 0.0,上海市崇明区绿华镇绿港村建闸1008号（近明珠湖）,10：00-11：30 1、食育研学主题活动指南-活动介绍绘本：认知，博学，阅读，理解！2、热身开场：让孩子欢快,"0.0,0.0"
上海·上海·崇明县,江南三民文化村,2884777027,展馆,3A景区,热度 0.0,上海市崇明县林风公路2201号,来见识爷爷用过，父亲知道，儿孙不懂的东西,"121.505342,31.723869"
上海·上海·崇明县,冰雪嘉年华,2338440664,运动健身,,热度 0.0,上海崇明县崇明岛旁江苏启东隆海路永兴中路路口,零下8℃酷爽夏天 绿地力量激“冻”魔都,"121.585303,31.724637"
上海·上海·东方明珠,上海历史发展陈列馆,3770730222,展馆,,热度 0.0,上海市浦东新区浦东世纪大道1号东方明珠零米大厅内,迫寻海上旧梦，景仰现代史实，品味文化上海,"121.506591,31.245076"
上海·上海·奉贤区,上海海湾国家森林公园,3751890594,公园,4A景区,热度 0.0,上海市奉贤区海湾镇随塘河路1677号,近似自然形态的人工森林,"121.692869,30.86719"
上海·上海·奉贤区,都市菜园,2550603555,农家度假,4A景区,热度 0.0,上海市奉贤区海湾镇海兴路888弄1号,放松身心、回归自然、享受健康快乐,"121.596707,30.871215"
上海·上海·虹口区,恐龙人俱乐部（上海白玉兰广场店）,2417602108,游乐场,,热度 0.0,上海市虹口区东大名路501号白玉兰广场一楼,家庭科教娱乐体验中心,"121.504484,31.25501"
上海·上海·黄浦区,城隍庙旅游区,2395325458,文化古迹,,热度 0.0,上海市黄浦区人民路、河南南路、上海老街、以及安仁路之间的区域,全面地领略到上海的历史文化和民俗风情,"121.499109,31.231135"
上海·上海·黄浦区,上海城隍庙,4027805800,文化古迹,,热度 0.76,上海市黄浦区方浜中路249号,“中华一绝”的民俗艺术,"121.49912146681,31.231409005048"
上海·上海·黄浦区,豫园,454305700,公园,4A景区,热度 0.8400000000000001,上海市黄浦区豫园老街279号,“奇秀甲于东南”、“东南名园冠”。,"121.498981,31.232772"
上海·上海·黄浦区,上海大世界,4066213664,游乐场,,热度 0.7,上海市黄浦区西藏南路1号,以游艺杂耍和南北戏曲、曲艺为其特色,"121.485885,31.233127"
上海·上海·黄浦区,上海外滩星空艺术馆,3332170458,游乐场,,热度 0.0,上海黄浦区中山东二路531号（外滩十六铺观光码头商城负2楼）,创新的奇妙时尚艺术馆,"121.502793,31.234169"
上海·上海·黄浦区,NBA乐园,2211484419,游乐场,,热度 0.0,上海市黄浦区湖滨路150号湖滨道购物中心二楼（靠近济南路）,一系列篮球元素为主的区域和活动内容,"121.485719,31.226676"
上海·上海·黄浦区,上海杜莎夫人蜡像馆,3759437369,展馆,4A景区,热度 0.74,上海市黄浦区南京西路2-68号新世界商厦10楼,走自己的红毯，与世界明星相遇,"121.480215,31.240715"
上海·上海·黄浦区,上海博物馆,58608629,展馆,4A景区,热度 0.76,上海市黄浦区人民大道201号,大型中国古代艺术博物馆，国内外享有盛誉,"121.482,31.2343"
上海·上海·黄浦区,上海失恋博物馆,1080679268,展馆,,热度 0.0,黄浦区南京东路悦荟广场四层,失恋过，没恋过，都精彩,"121.490283,31.24249"
上海·上海·黄浦区,上海城市规划展示馆,2233005325,展馆,4A景区,热度 0.7,上海市黄浦区人民大道100号,感受上海的“昨天、今天与明天”,"121.481888,31.237203"
上海·上海·黄浦区,大梦微城,358518940,展馆,,热度 0.0,上海市黄浦区河南南路489号香港名都L2层30-40,以火车模型微缩景观为特色的游乐场所,"121.496498,31.228579"
上海·上海·黄浦区,黄浦江游览（十六铺码头）,1908447004,城市观光,,热度 0.0,上海市黄浦区中山东二路481号B1层（十六铺码头一区）,夜游黄浦江，霓虹交错，赏魔都繁华景象,"121.503083,31.234893"
上海·上海·黄浦区,外滩,3323748173,城市观光,,热度 1.0,上海市黄浦区中山东一路（北至外白渡桥、南至十六铺码头）,感受上海十里洋场的风景,"121.497854,31.240722"
上海·上海·黄浦区,外滩观光隧道,555017412,城市观光,,热度 0.7,上海市黄浦区中山东一路349号（陈毅广场向北70米）,具有迷幻色彩的魅力隧道,"121.497043,31.245469"
上海·上海·黄浦区,南京路步行街,806060302,城市观光,,热度 0.82,上海市黄浦区,火树银花不夜天，霓虹商业一条街,"121.474776,31.234851"
上海·上海·黄浦区,上海人民广场,138957704,城市观光,,热度 0.72,中国上海黄浦区上海人民广场,融文化、绿化、美化为一体跨世纪活动中心,"121.48208011703,31.236832849459"
上海·上海·嘉定区,上海汽车博物馆,3368852951,展馆,,热度 0.7,上海市嘉定区安亭博园路7565号,汽车世界，等你来探索,"121.176622,31.284864"
上海·上海·嘉定区,上海博而地高尔夫俱乐部,672833949,运动健身,,热度 0.0,上海嘉定区宝安公路4188号,为您提供一流的服务，让您在这里享受快乐,"121.233294,31.325575"
上海·上海·金山区,花开海上生态园,1993697290,公园,,热度 0.0,上海市金山区朱泾镇待泾村秀泾6组6060号花开海上生态园,一年四季徜徉于花海中~,"121.1227,30.892008"
上海·上海·金山区,中国农民画村,3165629142,农家度假,3A景区,热度 0.0,上海市金山区枫泾镇朱枫公路8258弄169号,充满现代农村生活情趣，极具感染力和欣赏性,"121.023683,30.928096"
上海·上海·静安区,上海自然博物馆,2451036438,展馆,,热度 0.7,上海市静安区石门二路128号静安雕塑公园内,在这里领略物种的变迁,"121.469083,31.241294"
上海·上海·静安区,上海展览中心,93702188,展馆,,热度 0.72,上海静安区延安中路1000号,属于有代表性的社会服务性建筑物,"121.459321,31.230827"
上海·上海·卢湾区,琉璃中国博物馆,1736749137,展馆,,热度 0.0,上海市卢湾区泰康路25号,中国文学书画意境的延伸与再现,"121.47674,31.21384"
上海·上海·卢湾区,上海世博会博物馆,3199872196,展馆,,热度 0.0,卢湾区浦西世博园D片区蒙自路(局门路口),设计惊艳搭建一座“宝石”构成的“世博城”,"121.489161,31.199133"
上海·上海·闵行区,浦江郊野公园奇迹花园,3649760823,公园,,热度 0.0,上海市闵行区浦星公路2578弄8号,来奇迹花园开启一段花之奇旅吧,"121.509672,31.060409"
上海·上海·闵行区,锦江乐园,1256919432,游乐场,4A景区,热度 0.72,上海市闵行区虹梅路201号,不仅是孩子的乐园，更是成人的梦工厂,"121.417416,31.146669"
上海·上海·闵行区,银七星室内滑雪场,3664377022,运动健身,,热度 0.7,上海市闵行区七莘路1835号,国内首家专业室内滑雪场馆，规模亚洲少见,"121.366924,31.139672"
上海·上海·南翔古镇,南翔历史文化陈列馆,1173466485,展馆,,热度 0.0,上海市嘉定区南翔镇解放街260号,江南水乡迷人风景，透析南翔悠久历史,"121.314375,31.297793"
上海·上海·浦东新区,上海周浦花海,845891815,公园,,热度 0.0,上海市浦东新区周浦镇周邓公路申江路界浜村406号,一年四季鲜花不断，汇成令人迷醉的花海,"121.65535,31.118973"
上海·上海·浦东新区,上海世纪公园,2080797548,公园,4A景区,热度 0.72,上海市浦东新区浦东锦绣路1001号,环境“很嗲”，空气“清新”,"121.558497,31.221764"
上海·上海·浦东新区,上海滨海森林公园,1714460290,公园,3A景区,热度 0.0,上海市浦东新区滨海镇滨海旅游度假区东大公路5366号,捕捉风的影子，感受大自然的乐趣,"121.917909,30.969473"
上海·上海·浦东新区,滨江森林公园,1233759741,公园,,热度 0.7,上海市浦东新区最北端高桥镇三岔港,郊野森里公园，就在你的身边,"121.533982,31.389491"
上海·上海·浦东新区,上海迪士尼乐园,1174758904,游乐场,,热度 0.0,上海市浦东新区川沙新镇上海迪士尼度假区内,去哪儿付款码迪士尼园区内满120减50,"121.667917,31.149712"
上海·上海·浦东新区,上海科技馆,2033228323,展馆,5A景区,热度 0.74,上海市浦东新区世纪大道2000号(近二号线上海科技馆站),技术改变生活，只有想不到没有做不到,"121.54785,31.224219"
上海·上海·浦东新区,中国航海博物馆,393462509,展馆,4A景区,热度 0.0,上海市浦东新区申港大道197号,航海世界，你我同行,"121.926115,30.903535"
上海·上海·浦东新区,上海观复博物馆,1950078031,展馆,,热度 0.0,上海市浦东新区陆家嘴环路479号上海中心大厦37层,注重人与历史的沟通，突出传统文化的亲和力,"121.512317,31.239252"
上海·上海·浦东新区,上海大自然野生昆虫馆,1838324416,展馆,,热度 0.7,上海市浦东新区陆家嘴丰和路1号（东方明珠旁）,探索昆虫实际，感受到大自然的神奇魅力,"121.504309,31.246056"
上海·上海·浦东新区,震旦博物馆,2032832337,展馆,,热度 0.0,上海浦东新区富城路99号震旦国际大厦内（近名商路）,光影错落的奇特博物馆,"121.506153,31.240483"
上海·上海·浦东新区,上海东方地质科普馆,3502209371,展馆,,热度 0.0,上海市浦东新区祝桥镇江镇路100号,放松心灵，融汇亲情的绿色空间,"121.753499,31.18963"
上海·上海·浦东新区,环球猎奇馆,723785691,展馆,,热度 0.0,浦东新区滨江大道2789号外滩观光隧道B2楼(近上海国际会议中心),开阔你的眼界,"121.50381,31.243841"
上海·上海·浦东新区,东方明珠,1963366916,城市观光,5A景区,热度 0.76,上海市浦东新区世纪大道1号,感受云端漫步，品味老上海风情,"121.50626,31.245369"
上海·上海·浦东新区,上海中心大厦,2554590767,城市观光,,热度 0.0,上海市浦东新区陆家嘴环路479号（近东泰路）,超高层地标式摩天大楼,"121.512867,31.239758"
上海·上海·浦东新区,金茂大厦88层观光厅,2858490169,城市观光,4A景区,热度 0.76,上海市浦东新区浦东世纪大道88号观光厅,上海就在脚下,"121.512094,31.240746"
上海·上海·浦东新区,环球金融中心观光厅,2645793873,城市观光,4A景区,热度 0.72,上海市浦东新区世纪大道100号,来上海登三高，眺望魔都霓虹闪烁,"121.513463,31.23965"
上海·上海·浦东新区,东方明珠一日游,2976161924,城市观光,,热度 0.0,上海市浦东新区陆家嘴世纪大道1号,全方位的展现上海风貌,"121.506377,31.245105"
上海·上海·浦东新区,磁浮列车,4009309669,城市观光,,热度 0.0,上海市龙阳路2100号磁浮列车龙阳路站、上海浦东国际机场磁浮列车浦东机场站,体验飞一般的感觉,"121.57548581986,31.212437972831"
上海·上海·浦东新区,陆家嘴,1633761876,城市观光,,热度 0.0,上海市浦东新区西北部,上海金融中心区，感受高大上的金融世界,"121.513278,31.248139"
上海·上海·浦东新区,水宝宝,2796940946,运动健身,,热度 0.0,上海市浦东新区佳林路63号（近杨高北路）,婴儿游泳安全好去处,"121.613277,31.275474"
上海·上海·浦东新区,上海林克司高尔夫乡村俱乐部,1089336019,运动健身,,热度 0.0,上海市浦东新区凌白路1600号,该球场有,"121.767572,31.235242"
上海·上海·浦东新区,上海源深体育馆,1641073620,运动健身,,热度 0.0,上海浦东新区张杨路1458号源深体育中心内,三大体育中心之一,"121.542819,31.237342"
上海·上海·普陀区,长风公园,4242745712,公园,4A景区,热度 0.72,上海市普陀区大渡河路451号（长风公园4号门）,中国百家名园之一，人们休闲游玩的好去处,"121.407467,31.230999"
上海·上海·普陀区,上海乐高探索中心,3104235254,游乐场,,热度 0.0,上海市普陀区大渡河路上海长风公园对面景畔广场4楼,难忘刺激的乐高工厂之旅,"121.400607,31.229514"
上海·上海·普陀区,上海JOYPOLIS乐园,63280381,游乐场,,热度 0.0,上海市普陀区中山北路3300号环球港4楼L4081,身临其境感受无与伦比的美感,"121.418723,31.238504"
上海·上海·青浦区,朱家角古镇,2012753547,自然风光,4A景区,热度 0.72,上海市青浦区朱家角镇美周路36号,素有“上海威尼斯”及“沪郊好莱坞”之誉,"121.061605,31.116917"
